{
  "$schema": "https://json-schema.org/draft/2020-12/schema",
  "$id": "https://sprout.example/contracts/schemas/ota_device_event.schema.json",
  "title": "Device firmware update event",
  "type": "object",
  "additionalProperties": false,
  "required": [
    "schema_version",
    "event_id",
    "deployment_id",
    "release_id",
    "event_type",
    "sequence",
    "progress_percent",
    "firmware_version",
    "occurred_at"
  ],
  "properties": {
    "schema_version": {
      "type": "string",
      "const": "1.0.0"
    },
    "event_id": {
      "$ref": "https://sprout.example/contracts/schemas/common.schema.json#/$defs/identifier"
    },
    "deployment_id": {
      "$ref": "https://sprout.example/contracts/schemas/common.schema.json#/$defs/identifier"
    },
    "release_id": {
      "$ref": "https://sprout.example/contracts/schemas/common.schema.json#/$defs/identifier"
    },
    "event_type": {
      "type": "string",
      "enum": [
        "started",
        "downloading",
        "downloaded",
        "validated",
        "installing",
        "pending_verify",
        "succeeded",
        "failed",
        "rollback_started",
        "rolled_back"
      ]
    },
    "sequence": {
      "type": "integer",
      "format": "int64",
      "minimum": 1,
      "maximum": 9007199254740991
    },
    "progress_percent": {
      "type": "number",
      "minimum": 0,
      "maximum": 100
    },
    "bytes_received": {
      "type": "integer",
      "format": "int64",
      "minimum": 0
    },
    "bytes_total": {
      "type": "integer",
      "format": "int64",
      "minimum": 0
    },
    "error_code": {
      "type": "string",
      "pattern": "^[a-z][a-z0-9_]{2,63}$"
    },
    "message": {
      "type": "string",
      "maxLength": 1000
    },
    "detail": {
      "type": "object",
      "additionalProperties": true
    },
    "firmware_version": {
      "$ref": "https://sprout.example/contracts/schemas/common.schema.json#/$defs/firmware_version"
    },
    "artifact_sha256": {
      "$ref": "https://sprout.example/contracts/schemas/common.schema.json#/$defs/sha256"
    },
    "occurred_at": {
      "$ref": "https://sprout.example/contracts/schemas/common.schema.json#/$defs/timestamp"
    }
  }
}
